idx,content,pubdate,url,uid,pid,mid,testdate,status,retestdate,status_2,followers,error,topic,class
189,转发好消息：看视频《国家主权网络IPV9正式亮相》后，才知道为什么说网络安全就是国家安全，才知道为什么美国这么富有。我们每天打电话、微信、QQ和上网使用的都是美国的因特网IPV4母根服务器、主根服务器（即：互联网）。中国与美国签订了从2000年~2020年租用因特网20年的协议，每年向美国交租金，随着用量的增加每年租金都在上长，其中，2007年是5000亿，2017年是7800亿，到2020年最后一年是60000亿（六万亿），这只是中国的租金。全世界每个国家都租用美国的因特网，试想美国有多富？！举个美国的例子（用中国话来说），美国享受国家低保的人员包括在街上的乞讨人员在内，每天一日三餐的生活质量比中国普通的工薪阶层的生活质量还要好得多得多，不但衣食无忧，而且还可以到全球旅游，可见美国有多富。2014年，中国自己研发成功了具有自主知识产权的IPV9母根服务器、主根服务器，就与美国谈判要回话语权，被美国一票否决了。2015年，中国专家代表团在联大会员国会员中做试范介绍后，IPV9的安全性和质量远远超过了美国的IPV4和IPV6，被全体会员所接受，美国交出了话语权，联合国把话语权交给了中国。又经过谈判，在2017年美国又交出了管理权，联合国又把管理权交给了中国，并给了中国100年的使用和管理权。也就是说，当2020年租期一到，中国就可以使用具有自主知识产权的IPV9母根服务器、主根服务器。到现在已经有25个国家与中国签订了租用协议。2018年中国在全国所有接收发送站已经全部建成，2019年中国全国试运行，到2020年租期一到，关闭因特网，接上我国自己的新一代互联网，即物联网IPV9。如果说因特网IPV4、IPV6造就了美国的辉煌，那么，物联网IPV9从2021年开始到2120年的100年中将造就中国的辉煌。这就是中国政府向全世界庄严宣布实现两个一百年宏伟目标的底气所在。这才叫实力——请转发,12/21/18,https://weibo.com/2325804134/H8nJNz0kn,2325804134,H8nJNz0kn,4319980000000000.0,12/25/18,not available,12/26/18,not available,2686.0,Permission Denied!,china,censored
901,极左态势持续升级，不乏脑残极左“表忠”的成分，文革开始时也只是表表忠，讳疾忌医不纠正，只怕会天下大乱。,9/2/18,http://weibo.com/1446990952/GxqKhCm4m,1446990952,GxqKhCm4m,4279680000000000.0,9/5/18,not available,12/24/18,not available,199.0,Permission Denied!,cr,censored
908,【掷地有声】高老师说了自己的态度：“我在会上明确表示：1、米家山也年龄大了，能对自己当年野蛮暴行有所认识是好事情。2、不接受他的道歉。3、不见他。4、文革是国家和民族的巨大灾难，要道歉，首先要从大人物开始，你米家山当年打得好欢，现在要来道歉，你算老几哦！小人物！”,10/3/18,https://weibo.com/1561015262/GCjq1qc73,1561015262,GCjq1qc73,4291310000000000.0,10/7/18,not available,12/24/18,not available,1950021.0,Permission Denied!,cr,censored
480,昨日美股盘中惊人一跳，概因特朗普指示属下做好开征2000亿美元商品关税的行政程序。看来，毛衣战短期内还是没有缓和的余地，别幻想了。,9/15/18,http://weibo.com/1439207087/GzqZha1z9,1439207087,GzqZha1z9,4284450000000000.0,9/18/18,not available,12/27/18,not available,1039.0,Permission Denied!,trump,censored
329,另外从来没有什么chinese民族的伟大复兴，只有feudal社会的伟大复兴。宁与外邦不与家奴。窝里斗，底层互害。一层压一层。事不关己高高挂起。意识不到人权和民主的地方永远是跪着的。,12/11/18,https://weibo.com/2987610133/H6MtJ2i08,2987610133,H6MtJ2i08,4316160000000000.0,12/15/18,available,12/26/18,not available,144.0,Permission Denied!,democracy,censored
565,周一美股收盘之后，特朗普宣布对中国2000亿美元商品征收10%的关税这个消息其他渠道是有的，不过没有见官方的正式通报。,9/18/18,http://weibo.com/5977370392/GzTG05JV1,5977370392,GzTG05JV1,4285560000000000.0,9/22/18,not available,12/27/18,not available,104722.0,Permission Denied!,trump,censored
50,日本妈妈我感冒了嘤嘤嘤躺着别动妈妈立刻去给你买冰淇淋！中国妈妈我感冒了嘤嘤嘤多喝热水妈妈我想吃冰淇淋我看你长得像冰淇淋！……来到日本我觉得中日最大的文化差异：日本人感冒发烧要吃冰淇淋，很ok,11/29/18,https://weibo.com/2545520821/H4ZoNrvyy,2545520821,H4ZoNrvyy,4311890000000000.0,12/3/18,available,12/18/18,not available,200.0,Permission Denied!,china,censored
10161,燃了！宣传片《新时代的中国高铁》震撼亮相-在祖国广袤的大地上，两万五千公里钢铁大动脉正在强劲脉动。进入新时代，八纵八横世界最强高铁网正在纵横延展。在国家博物馆举办的伟大的变...O燃了！宣传片《新时代的中国高铁》震撼亮相,12/3/18,https://weibo.com/1357723287/H5yWnCWSv,1357723287,H5yWnCWSv,4313260000000000.0,12/7/18,available,12/19/18,available,1860.0,,china,uncensored
529,给我说中了！特朗普对中国新征2000亿产品关税。中美贸易战不会是短期的，边打边谈将是常态，以打促谈将是我国的最好策略，时间与我有利，前提是中国能争取到经济结构调整的时候，国内能稳定住房地产带来的巨额债务，这很难，十分不容易！,9/17/18,http://weibo.com/6495155311/GzL2Z2Hsy,6495155311,GzL2Z2Hsy,4285220000000000.0,9/21/18,not available,12/27/18,not available,210.0,Permission Denied!,trump,censored
10387,【改革开放是新时期中国解放思想的旗帜】改革开放是中国共产党人解放思想的经典之作，它一方面体现了破除一切思想禁锢、敢想敢闯敢干的开拓前进精神，另一方面体现了尊重客观规律、遵循先进理论指导的科学态度。体现在中国改革开放进程中的解放思想，不是思想上的自由放任，更不是思想上的虚无主义。,12/3/18,https://weibo.com/5266843093/H5D1PCQYV,5266843093,H5D1PCQYV,4313420000000000.0,12/7/18,available,12/19/18,available,1633079.0,,china,uncensored
30844,在另一边厢，加拿大第三季度经济增长放缓，加拿大央行12月利率声明更是暗示未来升息更趋谨慎，其鸽派立场无疑打击明年1月加息预期，加元因此快速走低并刷新两年半低位；尽管OPEC无视特朗普压低油价要求，但OPEC内部对减产规模仍有分歧。目前市场逐渐计价OPEC减产；一旦OPEC减产不及市场预期，国际油价再度走弱将拖累加元。澳洲第三季度GDP季率增长0.3%，仅为市场预期一半。澳洲季度经济放缓程度严重加之美股崩跌令澳元在触及4个月高位之后快速回落，短线反弹节奏面临终结风险；中美贸易紧张局势虽在G20峰会之后出现缓解，但市场对中美贸易谈判前景谨慎；后续一旦有关影响中美贸易谈判不利消息传出，澳元将有承压风险。,12/11/18,https://weibo.com/2710791357/H6KQbwmi4,2710791357,H6KQbwmi4,4316100000000000.0,12/15/18,available,12/26/18,available,295033.0,,trump,uncensored
447,川普天天跟自己国内的一帮人互怼，还跟国外，特别是中国怼啊怼，看看预期2000亿外，再来2670亿美元中国商品关税。斗志满满啊,9/8/18,http://weibo.com/1838123617/GyjsI0686,1838123617,GyjsI0686,4281780000000000.0,9/11/18,not available,12/26/18,not available,132.0,Permission Denied!,trump,censored
29602,川普的加关税只是个威胁的预期举措，怎么变成谈判筹码了？让他加啊，25%让美国通胀问题不大。,12/1/18,https://weibo.com/2216599381/H5lec2NPX,2216599381,H5lec2NPX,4312730000000000.0,12/5/18,available,12/18/18,available,700.0,,trump,uncensored
1961,多款iPhone被禁止销售受影响机型6S以上及iPhoneX高通也是美国的…内斗啊客观讲苹果手机系统用着确实好啊别说什么不爱国…,12/10/18,https://weibo.com/2321837993/H6HbogXQ7,2321837993,H6HbogXQ7,4315960000000000.0,12/14/18,available,12/25/18,available,25313.0,,patriotism,uncensored
187,许静19亿还是没有热搜对中国媒体很失望想骂人许静2019年我向总理说句话,12/21/18,https://weibo.com/5361439208/H8mKkDLRz,5361439208,H8mKkDLRz,4319940000000000.0,12/25/18,not available,12/26/18,not available,212.0,Permission Denied!,china,censored
1388,我在【追星有意义吗？】pk中，选择了【有】，偶像给我带来了正能量，你也快进入话题人为何要追星表态吧！有意义，我的爱豆是张艺兴，我艺兴哥哥是我的榜样，小哥哥三观很正，而且很努力，很爱国。,12/7/18,https://weibo.com/5092738934/H6ak8mONl,5092738934,H6ak8mONl,4314700000000000.0,12/11/18,available,12/22/18,available,63.0,,patriotism,uncensored
36924,历史已经多次印证：民主国家平时吵吵嚷嚷，一盘散沙，战时团结的像一只硬拳头。专制国家平时满脸狰狞，上上下下一副同仇敌忾的表象，真正打起来，往往马上土崩瓦解了。,10/6/18,https://weibo.com/1025894751/GCMYlDgoy,1025894751,GCMYlDgoy,4292450000000000.0,10/10/18,available,11/28/18,available,871.0,,democracy,uncensored
537,，美国媒体曝出特朗普可能最快在星期一，要对中国2000亿美元的进口商品加征关税下跌归因这个无数的闪崩就是垃圾股闪崩跟贸易战无关不明白这个点股市在拉起来会死的一样一样的惨！,9/17/18,http://weibo.com/3474920450/GzNGi1Vat,3474920450,GzNGi1Vat,4285320000000000.0,9/21/18,not available,12/27/18,not available,1622.0,Permission Denied!,trump,censored
13243,中美就贸易战达成停战共识，两国重新展开贸易谈判之际，美国总统特朗普（DonaldTrump）在社交网站Twitter发文，语调非常乐观，称正与中国进行非常有建设性的对话，并预告很快有重大公布，但无透露公布内容。,12/11/18,https://weibo.com/1132301460/H6N061m1Y,1132301460,H6N061m1Y,4316180000000000.0,12/15/18,available,12/26/18,available,19706.0,,china,uncensored
103,孟晚舟住宅遭闯入微博越来越垃圾，营销号也越来越没有底线，网民戾气太重，某些人格局小到也就能活成那样，私闯民宅不讨论，更别说这背后的阴谋，只在意人家在加拿大有房子？人家有钱为啥不能在国外买，在加拿大有房子就是丢中国脸，仇富严重，还不是因为自己过得不好，谁的钱都不是大风吹来的，不是自己努力也是父辈努力得来的，某些垃圾营销号带节奏蹭热度都不要脸了,12/10/18,https://weibo.com/1705419113/H6BKTiqzI,1705419113,H6BKTiqzI,4315750000000000.0,12/14/18,not available,12/16/18,not available,80.0,Permission Denied!,china,censored
26824,新福克斯民调显示，非裔美国人对特朗普总统的支持率为40%，创下共和党人的纪录。,11/4/18,https://weibo.com/5627561614/H1apkcCGn,5627561614,H1apkcCGn,4302780000000000.0,11/8/18,available,12/10/18,available,9006.0,,trump,uncensored
8561,【计划生育协会：明年着力解决群众不想生、不敢生、托育难】中国计划生育协会党组书记、常务副会长王培安介绍，2019年，计生协将深化优生优育促进行动，探索0-3岁婴幼儿照护和早期发展服务模式，帮助群众解决不想生、不敢生、托育难等问题，提高出生人口质量。点评：中国生育率下滑，有很多原因，最重要的是生孩子已经变成奢侈品，很多家庭负担不起。此外，高房价是最好的避孕药，孩子养大了，是要结婚生子的，结婚买不起房，自然不敢生了。二胎概念股，估计会借机炒作，关注爱婴室、金发拉比、邦宝益智等。,12/20/18,https://weibo.com/5618091575/H8cu2m5VC,5618091575,H8cu2m5VC,4319550000000000.0,12/24/18,available,1/4/19,available,6565.0,,fp,uncensored
186,“人民，只有人民，才是创造世界历史的动力。”中国大张旗鼓的过好“人民节”，就是创道历史，让酉方的“圣诞节”与中国的“人民节”融为一体，洋为中用，与世界接轨的中国方案。与时俱进的唯物主义与唯心主义各为其主，真理只有一条:阴阳是一个事物的正反两面，否极泰来，在斗争中创造历史。所以中国人12月25日过的是西方12月24日，根本不是“圣诞节”。反过来说，如果我们过“人民节”那么，西方12月25日=中国过12月26日“人民节”才是普天同庆。如果过节只是商业需要，那么在政治上还需要中国智慧来解决。2上海·上海四方新城,12/21/18,https://weibo.com/3265636660/H8l10cxKV,3265636660,H8l10cxKV,4319870000000000.0,12/25/18,not available,12/26/18,not available,800.0,Permission Denied!,china,censored
9266,5名消防员牺牲，13名消防员受伤，附近居民无一伤亡……这就是中国的消防员微博视频,12/1/18,https://weibo.com/2411394705/H5eJmoWz9,2411394705,H5eJmoWz9,4312480000000000.0,12/5/18,available,12/19/18,available,2169288.0,,china,uncensored
4732,德阳安医生国大地广，光明还没有洒向安医生的角落。应该会快了吧，依法治国，法治社会，不容践踏人权，不容漠视人命！相信国家相信法律会给安医生一个交代。举头三尺有神明，作恶多端终尝恶果！,9/2/18,http://weibo.com/2802690995/GxtoDs7aL,2802690995,GxtoDs7aL,4279780000000000.0,9/5/18,available,11/29/18,available,54.0,,hr,uncensored
22384,制裁美国驻华大使!制裁特朗普!O中央军委回应美制裁：召回计划访美的海军司令员,9/22/18,https://weibo.com/6178255713/GAE0aeajs,6178255713,GAE0aeajs,4287340000000000.0,9/26/18,available,12/1/18,available,84.0,,trump,uncensored
37572,十二公民中国版十二怒汉强推！不是所有人都懂法但不能失去了最基本的理性与责任“即便没有人关心真相，所有人只想发泄自己，但人言可畏，不要打着‘民主自由’的幌子侮辱了真正的真相。”,10/26/18,https://weibo.com/5217215762/GFHix5ZUS,5217215762,GFHix5ZUS,4299380000000000.0,10/30/18,available,11/29/18,available,171.0,,democracy,uncensored
865,2019年我向总理说句话许静请别再贱踏我那剩余不多的爱国之心！十三行许静杀人犯,12/20/18,https://weibo.com/2003465921/H8apUnYqt,2003465921,H8apUnYqt,4319470000000000.0,12/24/18,not available,12/25/18,not available,171.0,Permission Denied!,patriotism,censored
327,以前看到韭菜就还觉得幽默的笑笑，毕竟只是股市里。现在动不动就指代全体人民，实在是恶心。人类进化到社会以后，哪个时代，哪个地区不都是这么生活过来的。古典希腊时期人民不纳税了还是当今自由民主的美国不纳税了？秦始皇不征民夫修长城，隋炀帝不征民夫修运河，也许当时是好事儿，但是在历史的长河里，是坏事儿。觉得自己是韭菜的人，是不是抑郁啊，要不人死了就不是国家的韭菜和电池了。,12/9/18,https://weibo.com/2122762191/H6z3jtLiM,2122762191,H6z3jtLiM,4315650000000000.0,12/13/18,not available,12/16/18,not available,557.0,Permission Denied!,democracy,censored
37672,【基层动态】近日，本田摩托车研究开发有限公司工会被中华全国总工会授予“全国模范职工之家”荣誉称号。多年来，本田摩托车研究开发有限公司工会在上级工会的领导下，充分发挥工会的组织优势，充分履行职责，积极推进民主建设；不断加强职工队伍建设，逐步提升职工技能素质；深入开展送温暖活动，不断增强企业凝聚力；广泛开展劳动竞赛，促进生产工作提质增效。以维护职工权益为已任，以给职工建立一个和谐舒适的工作环境、积极解决职工后顾之忧为工作目标，真正做好职工代言人、娘家人。为丰富职工的业余文化生活，积极开展“职工之家”建设工作，配备娱乐设施和体育用品，组织职工参与文体活动，有力增强了职工的集体荣誉感和凝聚力，鼓舞职工以饱满的热情投入到工作中。被授予“全国模范职工之家”的荣誉，是对本田摩托车开发研究有限公司工会多年来着力企业与员工共同发展、构建和谐企业工作的充分肯定，企业工会将继续发扬务实作风，履职尽责，全心全意为职工办实事、做好事、解难事。,10/29/18,https://weibo.com/2792456300/H0ceI3P1u,2792456300,H0ceI3P1u,4300470000000000.0,11/2/18,available,11/29/18,available,4658.0,,democracy,uncensored
465,川普周五在“空军一号”专机上说：“我们正在谈论的2000亿美元可能很快就会发生。在某种程度上，这将取决于中国。我实在不想这么说，随后是另外2670亿美元，如果我愿意的话，可以在短时间内实行。”如果全部落实，那将意味着给中国出口美国的所有商品加税！,9/14/18,http://weibo.com/2032682983/GzebWpzWr,2032682983,GzebWpzWr,4283960000000000.0,9/17/18,not available,12/27/18,not available,1985.0,Permission Denied!,trump,censored
33093,罗瑞卿受到偌大恩宠，为何文革初来遭受到可怕厄运，拆遭迫害致残身死。【十位大将中唯一一位逝世后获降半旗致哀的是谁？】当消息传到国內，举国悲痛，当罗瑞卿骨灰运回国时，邓亲自到机场为他抬棺，为了哀悼这位人民的好公安，国家为他降半旗，他是十位大将中唯一一位逝世后降半旗哀悼的大将。（分享自O十位大将中唯一一位逝世后获降半旗致哀的是谁？,10/3/18,https://weibo.com/1374599765/GCjDMa6V6,1374599765,GCjDMa6V6,4291320000000000.0,10/7/18,available,1/1/19,available,552.0,,cr,uncensored
9914,【鲁迅中国小说史略钞】颓运方至，变故渐多；宝玉在繁华丰厚中，且亦屡与“无常”覿面，先有可卿自经；秦钟夭逝，自又中父妾厌胜之术，几死；继以金钏投井；尤二姐吞金；而所爱之侍儿晴雯又被遣，随殁。悲凉之雾，遍被华林，然呼吸而领会之者，独宝玉而已。,12/2/18,https://weibo.com/2712330293/H5tPqwhHp,2712330293,H5tPqwhHp,4313060000000000.0,12/6/18,available,12/19/18,available,1064.0,,china,uncensored
246,记|认识了小张的朋友一个希腊人我好想问他希腊是西方文明起源和民主滥觞成就远高于拉丁文学所以他作为现代的希腊人是否还有这样的民族自豪感小张怕我失望提醒我希腊让罗马人和土耳其人统治了那么多年早就不是希腊城邦那茬人了况且谁都不是历史的纵观者在时间线里从来都是依附存在我问他也不一定获得答案他的回答也不是答案想了想也对并不是每个人都有我的问题的答案的,9/19/18,http://weibo.com/2951318842/GA1X65LEL,2951318842,GA1X65LEL,4285870000000000.0,9/23/18,available,12/25/18,not available,1.0,Permission Denied!,democracy,censored
526,【关税飓风该来的还是要来】周日，CNBC在推特上援引一位高级政府官员报道称，到今天为止美国总统特朗普对价值2000亿美元的中国商品征收新关税已敲定，可能会在周一或周二公布。《华尔街日报》也说，特朗普最快周一宣布，向2000亿美元中国商品加征关税，但税率可能在10%，低于早前提出的25%。,9/17/18,http://weibo.com/1785476013/GzKvTEf7E,1785476013,GzKvTEf7E,4285200000000000.0,9/21/18,not available,12/27/18,not available,2344.0,Permission Denied!,trump,censored
746,不知为何，川普又跟共和党保守派评论家BillKristol撕逼了，发推嘲笑保守派杂志WeeklyStandard破产。有围观群众提醒川建国：你自己的生意破产过好几次了，怎么转眼就忘？,12/15/18,https://weibo.com/1980894733/H7tZdmi8z,1980894733,H7tZdmi8z,4317840000000000.0,12/19/18,not available,12/21/18,not available,5598.0,Permission Denied!,trump,censored
61,10:08FLASH:XI，TRUMPAGREETOSTOPIMPOSINGADDITIONALTARIFFS。（XinhuaNews）小财注：XI和特朗普同意停止进一步加征关税。之前的9月份，美国特朗普政府宣布，将于9月24日起对约2000亿美元的中国产品加征关税，税率为10%，并将在2019年1月1日起上升至25%。,12/1/18,https://weibo.com/2809099500/H5kZHqRpj,2809099500,H5kZHqRpj,4312720000000000.0,12/5/18,not available,12/16/18,not available,21171.0,Permission Denied!,china,censored
23917,美国现在有两党一教：民主党，以布什家族为例的被绑架的共和党，特疯邪教（以特朗普为例的伪富豪伪贵族共和党）。美国现在不是左派右派的问题，是：一群丢失了权钱地位的白种穷人（特朗普把他老爸的钱亏成负数），以共和党为根据地发起的造反，夺权夺钱）这就是本质。基本上，共和党被影响和绑架利用了，其实特疯邪教和共和党民主党都无关,10/7/18,https://weibo.com/1692715140/GCToFol9D,1692715140,GCToFol9D,4292690000000000.0,10/11/18,available,12/2/18,available,443.0,,trump,uncensored
15877,【足协副主席：新政是俱乐部自主选择】谈到即将出炉的财务新规，李毓毅直言：“中国足协没有想去限制任何俱乐部，今年一年和俱乐部沟通很多，足协一共调研过37个俱乐部，大家共同愿望的是游戏有一个公平的环境，而规范投入是促使公平的很重要的手段。”,12/18/18,https://weibo.com/5902965778/H7PB76wGy,5902965778,H7PB76wGy,4318670000000000.0,12/22/18,available,1/2/19,available,60955.0,,china,uncensored
12010,"华盛顿消息—美国总统特朗普对美中贸易谈判进展表示满意，并对两国在90天内达成经贸协议表示乐观。他星期五在推特上说：“跟中国的谈判进展非常顺利!特朗普在此前的一则推文中也曾对此表示乐观。他说：“中国商务部说方团队目前沟通顺畅、合作良好，我们对未来90天内达成协议充满信心。我同意。”美中两国领导人上月底在阿根廷G20峰会期间举行的晚宴上达成了贸易战休战90天的共识。中国商务部星期四表示，中方将立即落实中美双方已经达成共识的具体事项，并以取消所有加征关税为最终目标。在另一方面，特朗普的首席经济顾问库德洛星期五在接受美国商业新闻网CNBC采访时说，如果两国谈判取得良好进展，特朗普总统甚至考虑可以延长90天的期限""",12/7/18,https://weibo.com/2904943437/H6cZ8CcRv,2904943437,H6cZ8CcRv,4314800000000000.0,12/11/18,available,12/22/18,available,5461.0,,china,uncensored
897,和拥护流氓统治的人民谈素质？是不是蠢了点？既然是流氓国家，能随便没收土地、搞计划生育、搞三反五反，那人民素质也必然是低劣的，这应该是常识。比如美国。,11/18/18,https://weibo.com/2720683521/H3lAVjahS,2720683521,H3lAVjahS,4307980000000000.0,11/22/18,not available,12/28/18,not available,14000.0,Permission Denied!,fp,censored
744,最近的两个小观察：遇见几位生长于环京津地区的，非常之土，拍拍脑袋能掉土渣子，这种观念里的土根生蒂固；如果川普家的事儿是一部好莱坞电影，我这个白丁观众看到一半要开始啧啧下判断了：最大的反派肯定是女婿啊，看起来斯斯文文干干净净，其实暗黑又阴险。略累，说点闲话，,12/13/18,https://weibo.com/6549340828/H73qUaPBI,6549340828,H73qUaPBI,4316810000000000.0,12/17/18,not available,12/20/18,not available,13.0,Permission Denied!,trump,censored
3570,梁烈唯最佳男配角实至名归，这么多年不容易，因为爱国受了多少非议，好人有好报，唯唯加油,12/16/18,https://weibo.com/5337561301/H7ykih2IC,5337561301,H7ykih2IC,4318000000000000.0,12/20/18,available,1/1/19,available,95.0,,patriotism,uncensored
676,星期二，白宫国家经济委员会主任库德洛在白宫对媒体说，美中两国的政府“现在各个层面进行沟通。”他称这一进展是件“非常好的事。”库德洛还证实特朗普和CN领导人将于月底在布宜诺斯艾利斯会晤。他说，美方正在准备背景材料，希望能听到中方对美方过去半年左右时间里提出的要求有所回应。上个月，商务部长罗斯证实美中贸易谈判已经停止。美方表示，中方若不就美方提出的知识产权盗用、产业补贴以及市场准入设限等担忧作出切实的回应，贸易谈判就不会恢复。华尔街日报透露，特朗普政府正在评估中方提出的哪些种类的开放，是美方可接受的，包括农产品关税，技术转让，控制盗版，和保护知识产权等等。特朗普10月底曾表示，他认为有可能达成一项重大交易，他还称，倘若在阿根廷谈不拢，会在12月初再对2670亿美元的输美商品征收关税。,11/15/18,https://weibo.com/5666839797/H2SQAv8nP,5666839797,H2SQAv8nP,4306870000000000.0,11/19/18,not available,12/28/18,not available,43690.0,Permission Denied!,trump,censored
