idx,content,pubdate,url,uid,pid,mid,testdate,status,retestdate,status_2,followers,error,topic,class
26,2019年我向总理说句话集中爆发就在这一两年之内我真的看到了许多不公的事从北电侯亮平到红黄蓝再到现在的广州十三行从来没有一个人给过我们一个合理的交代我看到了微博一次次地撤热搜看到了一个个势力在压制真相他们等着就是这些事渐渐地在我们脑海中忘掉以为这样就可以过上太平日子了然而凭什么呢他们自在逍遥了受害人呢他们的家属呢将一辈子笼罩在这个阴影下所以还望国家将这所有的事情彻查清楚给所有人一个交代还有透过这些事情我坚信这每件事的背后都存在着一条很大的利益关系链断掉一个这后面的事全完了请国家一定要把每一条链都弄清楚了否则会有更大的乱子2019了我希望国家越来越好许静广州十三行杀人广州警方辟谣小伙被扔下楼,12/20/18,https://weibo.com/1931867614/H8a692m9s,1931867614,H8a692m9s,4319450000000000.0,12/24/18,not available,12/24/18,not available,41.0,Permission Denied!,kindergarten,censored
5586,突然想起了当年n刷士兵突击的日子了，那真是一段……卧槽张。国。立在说什么？这股政治邪风刮的啊，真他妈恶心。说到美国的所谓“政治正确”，好歹是关乎黑人人权、女性权益，当世界谈到我们的政治正确呢？泯灭自我然后再踩踏别人的人格和生活吗？这他妈丢人啊嘿。8012年了啊。,10/13/18,https://weibo.com/1573799972/GDLiJjlvK,1573799972,GDLiJjlvK,4294770000000000.0,10/17/18,available,11/30/18,available,200.0,,hr,uncensored
760,普京为什么会这样？据克里姆林宫12月30日披露的信息，这个年末，66岁的普京至少写了五封信，分别给美国总统特朗普、英国首相特雷莎·梅、日本首相安倍晋三、叙利亚总统阿萨德，以及中国最高领导人。,12/30/18,https://weibo.com/5304758736/H9KrJqoJF,5304758736,H9KrJqoJF,4323230000000000.0,1/3/19,not available,1/3/19,not available,343.0,Permission Denied!,trump,censored
318,要不是怕给傻子招黑我早就怼回去了自己搞不清状况还非得抬杠找这些人来工地中国早就被建设得富强民主美丽和谐了,12/2/18,https://weibo.com/5291842599/H5qirxufl,5291842599,H5qirxufl,4312930000000000.0,12/6/18,not available,12/15/18,not available,85.0,Permission Denied!,democracy,censored
30270,许多专家和老百姓都小看特朗普了。特朗普虽然是个商人，但一定不要把他当作商人来看待。从他的经历就可以看出，他的最大理想就是当个政治家。他以前对日本恨之入骨，现在他对中国充满敌意，作为美国总统，他会想方设法遏制中国。,12/6/18,https://weibo.com/1835996093/H60SZnp7s,1835996093,H60SZnp7s,4314330000000000.0,12/10/18,available,12/21/18,available,183.0,,trump,uncensored
17851,孟晚舟曾在清华演讲中说过，勇敢不是不害怕，而是心中有信念。胜人者力，自胜者强。今天温哥华法庭举行的保释听证会，华为CFO孟晚舟，同样表现出一种令人印象深刻的气象：面临无理的拘扣和刁难，不惧、不畏、不怒，而是平静如水、从容自若、淡定自如！,12/10/18,https://weibo.com/1295499705/H6zMrv7kN,1295499705,H6zMrv7kN,4315680000000000.0,12/14/18,available,12/26/18,available,920.0,,meng,uncensored
888,大家要注意了，撤销计划生育相关机构，就意味着，你党准备撸起袖子在生孩子方面大干一场了。因为没有清算。,9/11/18,http://weibo.com/1676582524/GyQrweipI,1676582524,GyQrweipI,4283050000000000.0,9/14/18,not available,12/28/18,not available,934648.0,Permission Denied!,fp,censored
30326,美国（政府）为何“无视”气候变化协议？最重要的根本原因之一是美国在议会上通过的减税法案。（在特朗普上台初期）美国国会参、众两院顺利通过了修订后的减税法案，美国税改方案最终敲定并通过。个税降低了，企业税从35%降到了15%，企业外汇汇回美国的一次性利得税也从35%降到了10%。可以说，美国现在的税收比世界上其他有些国家的税收还低。但问题是相关的环保税也被压缩了。由此导致美国（特朗普政府）淡视了环保税，甚至，特朗普都不相信气候变化协议的必要性，更是说：我们应为美国负责，而不该为其他国家排放污染“买单”。因此，美国（政府）这样的做法遭到世界各国的反对。美国（政府）是以生命为代价赚取收益，最后是“有钱没命花”。得不偿失的。（美国有些影片常说一句台词：“现在能活者，也只剩下钱了，别的都没有了。”这是美国资本家在生命最后的时刻最真实的感慨）美国（政府）一方在重振经济，一方却极大伤害世界各国的利益。,12/6/18,https://weibo.com/2729294784/H64Ou3GtX,2729294784,H64Ou3GtX,4314480000000000.0,12/10/18,available,12/21/18,available,28367.0,,trump,uncensored
181,2019年我向总理说句话总理您好，我是一名遵纪守法的公民。我爱中国，爱这个和平的国家。可是最近广州十三行许静女老板雇凶杀人，没有一个媒体敢出来发声，广州越秀公安玩文字游戏，X浪一个劲的撤热搜，微信贴吧各种删帖屏蔽，请问一个人的后台是多么如此强大？如果今天的我们袖手旁观，那么明天就可能被施暴无援而绝望，我还是相信国家能给我们一个答案，一个真相。严惩恶人，不能让坏人逍遥法外。无权无势的我们就只能眼睁睁看着这个事被压下去，特别无力。而最后如果这真相被说成谣言那么真的是感到心寒。,12/20/18,https://weibo.com/1290386577/H8dKn7d64,1290386577,H8dKn7d64,4319590000000000.0,12/24/18,not available,12/25/18,not available,170.0,Permission Denied!,china,censored
775,孟晚舟保释听证会现场『孟晚舟保释听证会现场直击：国籍、控罪、激辩全纪实』O孟晚舟保释听证会现场直击：国籍、控罪、激辩全纪实,12/8/18,https://weibo.com/5081544105/H6gCgeati,5081544105,H6gCgeati,4314940000000000.0,12/12/18,not available,12/17/18,not available,574.0,Permission Denied!,meng,censored
